code,name,description,language,category,category-name,category-description
A,Budget support,"For contributions under this category, the donor relinquishes the exclusive control of its funds by sharing the responsibility with the recipient.",en,,,
B,Core contributions and pooled programmes and funds,"For contributions under this category, the donor relinquishes the exclusive control of its funds by sharing the responsibility with other stakeholders (other donors, NGOs, multilateral institutions, Public Private Partnerships). The category covers both core contributions (B01 and B02), and pooled contributions with a specific earmarking (B03 and B04).",en,,,
C,Project-type interventions,"N.B.  Within this category, members able to do so are requested to report the aggregate amount used for financing donor experts/consultants on Table DAC11. Where the activity consists solely of experts’ costs, report under category D.",en,,,
D,Experts and other technical assistance,"This category covers the provision, outside projects as described in category C, of know-how in the form of personnel, training and research.",en,,,
E,Scholarships and student costs in donor countries,,en,,,
F,Debt relief,,en,,,
G,Administrative costs not included elsewhere,,en,,,
H,Other in-donor expenditures,Groups a number of contributions that do not give rise to a cross-border flow.,en,,,
