code,name,description,language,category,category-name,category-description
PPLA3,seat of a third-order administrative division,seat of a third-order administrative division,en,P,Populated Place,
ADM2,second-order administrative division,a subdivision of a first-order administrative division,en,A,Administrative Region,
BNKX,section of bank,section of bank,en,H,Hydrographic,
CNLX,section of canal,section of canal,en,H,Hydrographic,
ESTX,section of estate,section of estate,en,S,Spot Features,
HBRX,section of harbor,section of harbor,en,H,Hydrographic,
PCLIX,section of independent political entity,section of independent political entity,en,A,Administrative Region,
STMIX,section of intermittent stream,section of intermittent stream,en,H,Hydrographic,
ISLX,section of island,section of island,en,T,Hypsographic,
LGNX,section of lagoon,section of lagoon,en,H,Hydrographic,
LKX,section of lake,section of lake,en,H,Hydrographic,
PENX,section of peninsula,section of peninsula,en,T,Hypsographic,
PLNX,section of plain,section of plain,en,T,Hypsographic,
PLATX,section of plateau,section of plateau,en,T,Hypsographic,
PPLX,section of populated place,section of populated place,en,P,Populated Place,
RFX,section of reef,section of reef,en,H,Hydrographic,
STMX,section of stream,section of stream,en,H,Hydrographic,
VALX,section of valley,section of valley,en,T,Hypsographic,
WADX,section of wadi,section of wadi,en,H,Hydrographic,
FLLSX,section of waterfall(s),section of waterfall(s),en,H,Hydrographic,
PCLS,semi-independent political entity,semi-independent political entity,en,A,Administrative Region,
SWT,sewage treatment plant,facility for the processing of sewage and/or wastewater,en,S,Spot Features,
SHPF,sheepfold,a fence or wall enclosure for sheep and other small herd animals,en,S,Spot Features,
SHOL,shoal(s),a surface-navigation hazard composed of unconsolidated material,en,H,Hydrographic,
SHOPC,shopping center or mall,an urban shopping area featuring a variety of shops surrounding a usually open-air concourse reserved for pedestrian traffic; or a large suburban building or group of buildings containing various shops with associated passageways,en,S,Spot Features,
SHOR,shore,"a narrow zone bordering a waterbody which covers and uncovers at high and low water, respectively",en,T,Hypsographic,
SHRN,shrine,a structure or place memorializing a person or religious concept,en,S,Spot Features,
SILL,sill,the low part of a gap or saddle separating basins,en,H,Hydrographic,
SINK,sinkhole,a small crater-shape depression in a karst area,en,T,Hypsographic,
ESTSL,sisal plantation,an estate that specializes in growing sisal,en,S,Spot Features,
SLID,slide,"a mound of earth material, at the base of a slope and the associated scoured area",en,T,Hypsographic,
SLP,slope(s),a surface with a relatively uniform slope angle,en,T,Hypsographic,
SLCE,sluice,"a conduit or passage for carrying off surplus water from a waterbody, usually regulated by means of a sluice gate",en,S,Spot Features,
SNOW,snowfield,an area of permanent snow and ice forming the accumulation area of a glacier,en,L,Area,
SD,sound,a long arm of the sea forming a channel between the mainland and an island or islands; or connecting two larger bodies of water,en,H,Hydrographic,
SPA,spa,a resort area usually developed around a medicinal spring,en,S,Spot Features,
CTRS,space center,"a facility for launching, tracking, or controlling satellites and space vehicles",en,S,Spot Features,
SPLY,spillway,"a passage or outlet through which surplus water flows over, around or through a dam",en,S,Spot Features,
SPIT,spit,"a narrow, straight or curved continuation of a beach into a waterbody",en,T,Hypsographic,
SPNG,spring(s),a place where ground water flows naturally out of the ground,en,H,Hydrographic,
SPUR,spur(s),"a subordinate ridge projecting outward from a hill, mountain or other elevation",en,T,Hypsographic,
SQR,square,"a broad, open, public area near the center of a town or city",en,S,Spot Features,
STBL,stable,"a building for the shelter and feeding of farm animals, especially horses",en,S,Spot Features,
STDM,stadium,a structure with an enclosure for athletic games with tiers of seats for spectators,en,S,Spot Features,
STPS,steps,stones or slabs placed for ease in ascending or descending a steep slope,en,S,Spot Features,
STKR,stock route,a route taken by livestock herds,en,R,Streets/Highways/Roads,
REG,stony desert,a desert plain characterized by a surface veneer of gravel and stones,en,T,Hypsographic,
RET,store,a building where goods and/or services are offered for sale,en,S,Spot Features,
SHSE,storehouse,"a building for storing goods, especially provisions",en,S,Spot Features,
STRT,strait,"a relatively narrow waterway, usually narrower and less extensive than a sound, connecting two larger bodies of water",en,H,Hydrographic,
STM,stream,a body of running water moving to a lower level in a channel on land,en,H,Hydrographic,
BNKR,stream bank,a sloping margin of a stream channel which normally confines the stream to its channel on land,en,H,Hydrographic,
STMB,stream bend,a conspicuously curved or bent segment of a stream,en,H,Hydrographic,
STMGS,stream gauging station,"named place where a measuring station for a watercourse, reservoir or other water body exists",en,S,Spot Features,
STMM,stream mouth(s),"a place where a stream discharges into a lagoon, lake, or the sea",en,H,Hydrographic,
STMS,streams,bodies of running water moving to a lower level in a channel on land,en,H,Hydrographic,
ST,street,a paved urban thoroughfare,en,R,Streets/Highways/Roads,
DAMSB,sub-surface dam,a dam put down to bedrock in a sand river,en,S,Spot Features,
SUBW,subway,"a railroad used for mass public transportation primarily in urban areas, all or part of the system may be located below, above, or at ground level",en,S,Spot Features,
SUBS,subway station,"a facility comprising ticket office, platforms, etc. for loading and unloading subway passengers",en,S,Spot Features,
MLSG,sugar mill,a facility where sugar cane is processed into raw sugar,en,S,Spot Features,
ESTSG,sugar plantation,an estate that specializes in growing sugar cane,en,S,Spot Features,
MFGSG,sugar refinery,a facility for converting raw sugar into refined sugar,en,S,Spot Features,
SPNS,sulphur spring(s),a place where sulphur ground water flows naturally out of the ground,en,H,Hydrographic,
SWMP,swamp,a wetland dominated by tree vegetation,en,H,Hydrographic,
SYG,synagogue,a place for Jewish worship and religious instruction,en,S,Spot Features,
TMTU,tablemount (or guyot),"a seamount having a comparatively smooth, flat top",en,U,Undersea,
TMSU,tablemounts (or guyots),"seamounts having a comparatively smooth, flat top",en,U,Undersea,
TAL,talus slope,a steep concave slope formed by an accumulation of loose rock fragments at the base of a cliff or steep slope,en,T,Hypsographic,
OILT,tank farm,"a tract of land occupied by large, cylindrical, metal tanks in which oil or liquid petrochemicals are stored",en,S,Spot Features,
ESTT,tea plantation,an estate which specializes in growing tea bushes,en,S,Spot Features,
SCHT,technical school,post-secondary school with a specifically technical or vocational curriculum,en,S,Spot Features,
TMPL,temple(s),an edifice dedicated to religious worship,en,S,Spot Features,
AIRT,terminal,airport facilities for the handling of freight and passengers,en,S,Spot Features,
TRR,terrace,"a long, narrow alluvial platform bounded by steeper slopes above and below, usually overlooking a waterbody",en,T,Hypsographic,
TERR,territory,territory,en,A,Administrative Region,
ADM3,third-order administrative division,a subdivision of a second-order administrative division,en,A,Administrative Region,
CRKT,tidal creek(s),a meandering channel in a coastal wetland subject to bi-directional tidal currents,en,H,Hydrographic,
FLTT,tidal flat(s),a large flat area of mud or sand attached to the shore and alternately covered and uncovered by the tide,en,H,Hydrographic,
MNSN,tin mine(s),a mine where tin ore is extracted,en,S,Spot Features,
TOLL,toll gate/barrier,highway toll collection station,en,S,Spot Features,
TMB,tomb(s),a structure for interring bodies,en,S,Spot Features,
TOWR,tower,"a high conspicuous structure, typically much higher than its diameter",en,S,Spot Features,
RDCR,traffic circle,a road junction formed around a central circle about which traffic moves in one direction only,en,S,Spot Features,
TRL,trail,"a path, track, or route used by pedestrians, animals, or off-road vehicles",en,R,Streets/Highways/Roads,
TRANT,transit terminal,facilities for the handling of vehicular freight and passengers,en,S,Spot Features,
TREE,tree(s),a conspicuous tree used as a landmark,en,V,Vegetation,
TRIG,triangulation station,a point on the earth whose position has been determined by triangulation,en,S,Spot Features,
TRB,tribal area,a tract of land used by nomadic or other tribes,en,L,Area,
TUND,tundra,"a marshy, treeless, high latitude plain, dominated by mosses, lichens, and low shrub vegetation under permafrost conditions",en,V,Vegetation,
TNL,tunnel,a subterranean passageway for transportation,en,R,Streets/Highways/Roads,
TNLS,tunnels,subterranean passageways for transportation,en,R,Streets/Highways/Roads,
CNLSB,underground irrigation canal(s),a gently inclined underground tunnel bringing water for irrigation from aquifers,en,H,Hydrographic,
LKSB,underground lake,a standing body of water in a cave,en,H,Hydrographic,
APNU,undersea apron,"a gentle slope, with a generally smooth surface, particularly found around groups of islands and seamounts",en,U,Undersea,
ARCU,undersea arch,a low bulge around the southeastern end of the island of Hawaii,en,U,Undersea,
ARRU,undersea arrugado,an area of subdued corrugations off Baja California,en,U,Undersea,
BNKU,undersea bank,"an elevation, typically located on a shelf, over which the depth of water is relatively shallow but sufficient for safe surface navigation",en,U,Undersea,
BKSU,undersea banks,"elevations, typically located on a shelf, over which the depth of water is relatively shallow but sufficient for safe surface navigation",en,U,Undersea,
BSNU,undersea basin,a depression more or less equidimensional in plan and of variable extent,en,U,Undersea,
BNCU,undersea bench,a small terrace,en,U,Undersea,
BDLU,undersea borderland,"a region adjacent to a continent, normally occupied by or bordering a shelf, that is highly irregular with depths well in excess of those typical of a shelf",en,U,Undersea,
CNYU,undersea canyon,"a relatively narrow, deep depression with steep sides, the bottom of which generally has a continuous slope",en,U,Undersea,
CNSU,undersea canyons,"relatively narrow, deep depressions with steep sides, the bottom of which generally has a continuous slope",en,U,Undersea,
CDAU,undersea cordillera,"an entire mountain system including the subordinate ranges, interior plateaus, and basins",en,U,Undersea,
ESCU,undersea escarpment (or scarp),an elongated and comparatively steep slope separating flat or gently sloping areas,en,U,Undersea,
FANU,undersea fan,a relatively smooth feature normally sloping away from the lower termination of a canyon or canyon system,en,U,Undersea,
FLTU,undersea flat,a small level or nearly level area,en,U,Undersea,
FRKU,undersea fork,a branch of a canyon or valley,en,U,Undersea,
FRSU,undersea forks,a branch of a canyon or valley,en,U,Undersea,
FRZU,undersea fracture zone,"an extensive linear zone of irregular topography of the sea floor, characterized by steep-sided or asymmetrical ridges, troughs, or escarpments",en,U,Undersea,
FURU,undersea furrow,"a closed, linear, narrow, shallow depression",en,U,Undersea,
GAPU,undersea gap,a narrow break in a ridge or rise,en,U,Undersea,
GLYU,undersea gully,a small valley-like feature,en,U,Undersea,
HLLU,undersea hill,an elevation rising generally less than 500 meters,en,U,Undersea,
HLSU,undersea hills,elevations rising generally less than 500 meters,en,U,Undersea,
HOLU,undersea hole,a small depression of the sea floor,en,U,Undersea,
KNLU,undersea knoll,"an elevation rising generally more than 500 meters and less than 1,000 meters and of limited extent across the summit",en,U,Undersea,
KNSU,undersea knolls,"elevations rising generally more than 500 meters and less than 1,000 meters and of limited extent across the summits",en,U,Undersea,
LDGU,undersea ledge,"a rocky projection or outcrop, commonly linear and near shore",en,U,Undersea,
LEVU,undersea levee,"an embankment bordering a canyon, valley, or seachannel",en,U,Undersea,
MDVU,undersea median valley,the axial depression of the mid-oceanic ridge system,en,U,Undersea,
MESU,undersea mesa,"an isolated, extensive, flat-topped elevation on the shelf, with relatively steep sides",en,U,Undersea,
MOTU,undersea moat,"an annular depression that may not be continuous, located at the base of many seamounts, islands, and other isolated elevations",en,U,Undersea,
MNDU,undersea mound,"a low, isolated, rounded hill",en,U,Undersea,
MTU,undersea mountain,a well-delineated subdivision of a large and complex positive feature,en,U,Undersea,
MTSU,undersea mountains,well-delineated subdivisions of a large and complex positive feature,en,U,Undersea,
PKU,undersea peak,"a prominent elevation, part of a larger feature, either pointed or of very limited extent across the summit",en,U,Undersea,
PKSU,undersea peaks,"prominent elevations, part of a larger feature, either pointed or of very limited extent across the summit",en,U,Undersea,
PNLU,undersea pinnacle,"a high tower or spire-shaped pillar of rock or coral, alone or cresting a summit",en,U,Undersea,
PLNU,undersea plain,"a flat, gently sloping or nearly level region",en,U,Undersea,
PLTU,undersea plateau,"a comparatively flat-topped feature of considerable extent, dropping off abruptly on one or more sides",en,U,Undersea,
PLFU,undersea platform,a flat or gently sloping underwater surface extending seaward from the shore,en,U,Undersea,
PRVU,undersea province,a region identifiable by a group of similar physiographic features whose characteristics are markedly in contrast with surrounding areas,en,U,Undersea,
RMPU,undersea ramp,a gentle slope connecting areas of different elevations,en,U,Undersea,
RNGU,undersea range,a series of associated ridges or seamounts,en,U,Undersea,
RAVU,undersea ravine,a small canyon,en,U,Undersea,
RFU,undersea reef,a surface-navigation hazard composed of consolidated material,en,U,Undersea,
RFSU,undersea reefs,surface-navigation hazards composed of consolidated material,en,U,Undersea,
RDGU,undersea ridge,a long narrow elevation with steep sides,en,U,Undersea,
RDSU,undersea ridges,long narrow elevations with steep sides,en,U,Undersea,
RISU,undersea rise,"a broad elevation that rises gently, and generally smoothly, from the sea floor",en,U,Undersea,
SDLU,undersea saddle,"a low part, resembling in shape a saddle, in a ridge or between contiguous seamounts",en,U,Undersea,
SHFU,undersea shelf,a zone adjacent to a continent (or around an island) that extends from the low water line to a depth at which there is usually a marked increase of slope towards oceanic depths,en,U,Undersea,
EDGU,undersea shelf edge,a line along which there is a marked increase of slope at the outer margin of a continental shelf or island shelf,en,U,Undersea,
SHVU,undersea shelf valley,"a valley on the shelf, generally the shoreward extension of a canyon",en,U,Undersea,
SHLU,undersea shoal,a surface-navigation hazard composed of unconsolidated material,en,U,Undersea,
SHSU,undersea shoals,hazards to surface navigation composed of unconsolidated material,en,U,Undersea,
SILU,undersea sill,"the low part of an underwater gap or saddle separating basins, including a similar feature at the mouth of a fjord",en,U,Undersea,
SLPU,undersea slope,the slope seaward from the shelf edge to the beginning of a continental rise or the point where there is a general reduction in slope,en,U,Undersea,
SPRU,undersea spur,"a subordinate elevation, ridge, or rise projecting outward from a larger feature",en,U,Undersea,
TERU,undersea terrace,"a relatively flat horizontal or gently inclined surface, sometimes long and narrow, which is bounded by a steeper ascending slope on one side and by a steep descending slope on the opposite side",en,U,Undersea,
TNGU,undersea tongue,an elongate (tongue-like) extension of a flat sea floor into an adjacent higher feature,en,U,Undersea,
TRNU,undersea trench,"a long, narrow, characteristically very deep and asymmetrical depression of the sea floor, with relatively steep sides",en,U,Undersea,
TRGU,undersea trough,"a long depression of the sea floor characteristically flat bottomed and steep sided, and normally shallower than a trench",en,U,Undersea,
VALU,undersea valley,"a relatively shallow, wide depression, the bottom of which usually has a continuous gradient",en,U,Undersea,
VLSU,undersea valleys,"a relatively shallow, wide depression, the bottom of which usually has a continuous gradient",en,U,Undersea,
USGE,United States Government Establishment,a facility operated by the United States Government in Panama,en,S,Spot Features,
UPLD,upland,an extensive interior region of high land with low to moderate surface relief,en,T,Hypsographic,
VAL,valley,an elongated depression usually traversed by a stream,en,T,Hypsographic,
VALS,valleys,elongated depressions usually traversed by a stream,en,T,Hypsographic,
VETF,veterinary facility,a building or camp at which veterinary services are available,en,S,Spot Features,
VIN,vineyard,a planting of grapevines,en,V,Vegetation,
VINS,vineyards,plantings of grapevines,en,V,Vegetation,
VLC,volcano,a conical elevation composed of volcanic materials with a crater at the top,en,T,Hypsographic,
WAD,wadi,"a valley or ravine, bounded by relatively steep banks, which in the rainy season becomes a watercourse; found primarily in North Africa and the Middle East",en,H,Hydrographic,
WADB,wadi bend,a conspicuously curved or bent segment of a wadi,en,H,Hydrographic,
WADJ,wadi junction,a place where two or more wadies join,en,H,Hydrographic,
WADM,wadi mouth,"the lower terminus of a wadi where it widens into an adjoining floodplain, depression, or waterbody",en,H,Hydrographic,
WADS,wadies,"valleys or ravines, bounded by relatively steep banks, which in the rainy season become watercourses; found primarily in North Africa and the Middle East",en,H,Hydrographic,
WALL,wall,"a thick masonry structure, usually enclosing a field or building, or forming the side of a structure",en,S,Spot Features,
MLWTR,water mill,a mill powered by running water,en,S,Spot Features,
PMPW,water pumping station,a facility for pumping water from a major well or through a pipeline,en,S,Spot Features,
RSVT,water tank,"a contained pool or tank of water at, below, or above ground level",en,H,Hydrographic,
WTRC,watercourse,"a natural, well-defined channel produced by flowing water, or an artificial channel designed to carry flowing water",en,H,Hydrographic,
FLLS,waterfall(s),a perpendicular or very steep descent of the water of a stream,en,H,Hydrographic,
WTRH,waterhole(s),"a natural hole, hollow, or small depression that contains water, used by man and animals, especially in arid areas",en,H,Hydrographic,
WTRW,waterworks,a facility for supplying potable water through a water source and a system of pumps and filtration beds,en,S,Spot Features,
WEIR,weir(s),"a small dam in a stream, designed to raise the water level or to divert stream flow through a desired channel",en,S,Spot Features,
WLL,well,"a cylindrical hole, pit, or tunnel drilled or dug down to a depth from which water, oil, or gas can be pumped or brought to the surface",en,H,Hydrographic,
WLLS,wells,"cylindrical holes, pits, or tunnels drilled or dug down to a depth from which water, oil, or gas can be pumped or brought to the surface",en,H,Hydrographic,
WTLD,wetland,"an area subject to inundation, usually characterized by bog, marsh, or swamp vegetation",en,H,Hydrographic,
STNW,whaling station,a facility for butchering whales and processing train oil,en,S,Spot Features,
WHRF,wharf(-ves),a structure of open rather than solid construction along a shore or a bank which provides berthing for ships and cargo-handling facilities,en,S,Spot Features,
WHRL,whirlpool,"a turbulent, rotating movement of water in a stream",en,H,Hydrographic,
RESW,wildlife reserve,a tract of public land reserved for the preservation of wildlife,en,L,Area,
MLWND,windmill,a mill or water pump powered by wind,en,S,Spot Features,
WRCK,wreck,the site of the remains of a wrecked vessel,en,S,Spot Features,
ZN,zone,zone,en,A,Administrative Region,
ZOO,zoo,a zoological garden or park where wild animals are kept for exhibition,en,S,Spot Features,
