code,name,description,language,category,category-name,category-description
AIRQ,abandoned airfield,abandoned airfield,en,S,Spot Features,
CMPQ,abandoned camp,abandoned camp,en,S,Spot Features,
CNLQ,abandoned canal,abandoned canal,en,H,Hydrographic,
MFGQ,abandoned factory,abandoned factory,en,S,Spot Features,
FRMQ,abandoned farm,abandoned farm,en,S,Spot Features,
MNQ,abandoned mine,abandoned mine,en,S,Spot Features,
MSSNQ,abandoned mission,abandoned mission,en,S,Spot Features,
OILQ,abandoned oil well,abandoned oil well,en,S,Spot Features,
PPQ,abandoned police post,abandoned police post,en,S,Spot Features,
PPLQ,abandoned populated place,abandoned populated place,en,P,Populated Place,
PRNQ,abandoned prison,abandoned prison,en,S,Spot Features,
RRQ,abandoned railroad,abandoned railroad,en,R,Streets/Highways/Roads,
RSTNQ,abandoned railroad station,abandoned railroad station,en,S,Spot Features,
RSTPQ,abandoned railroad stop,abandoned railroad stop,en,S,Spot Features,
STMQ,abandoned watercourse,"a former stream or distributary no longer carrying flowing water, but still evident due to lakes, wetland, topographic or vegetation patterns",en,H,Hydrographic,
WLLQ,abandoned well,abandoned well,en,H,Hydrographic,
ADMD,administrative division,"an administrative division of a political entity, undifferentiated as to administrative level",en,A,Administrative Region,
ADMF,administrative facility,a government building,en,S,Spot Features,
AGRC,agricultural colony,a tract of land set aside for agricultural settlement,en,L,Area,
AGRF,agricultural facility,a building and/or tract of land used for improving agriculture,en,S,Spot Features,
RESA,agricultural reserve,a tract of land reserved for agricultural reclamation and/or development,en,L,Area,
SCHA,agricultural school,a school with a curriculum focused on agriculture,en,S,Spot Features,
AIRB,airbase,"an area used to store supplies, provide barracks for air force personnel, hangars and runways for aircraft, and from which operations are initiated",en,S,Spot Features,
AIRF,airfield,a place on land where aircraft land and take off; no facilities provided for the commercial handling of passengers and cargo,en,S,Spot Features,
AIRP,airport,"a place where aircraft regularly land and take off, with runways, navigational aids, and major facilities for the commercial handling of passengers and cargo",en,S,Spot Features,
AMTH,amphitheater,an oval or circular structure with rising tiers of seats about a stage or open space,en,S,Spot Features,
STMA,anabranch,a diverging branch flowing out of a main stream and rejoining it downstream,en,H,Hydrographic,
ANCH,anchorage,an area where vessels may anchor,en,H,Hydrographic,
RDA,ancient road,the remains of a road used by ancient cultures,en,R,Streets/Highways/Roads,
ANS,ancient site,"a place where archeological remains, old structures, or cultural artifacts are located",en,S,Spot Features,
WALLA,ancient wall,the remains of a linear defensive stone structure,en,S,Spot Features,
BLDA,apartment building,a building containing several individual apartments,en,S,Spot Features,
AQC,aquaculture facility,"facility or area for the cultivation of aquatic animals and plants, especially fish, shellfish, and seaweed, in natural or controlled marine or freshwater environments; underwater agriculture",en,S,Spot Features,
CNLA,aqueduct,a conduit used to carry water,en,H,Hydrographic,
ARCH,arch,a natural or man-made structure in the form of an arch,en,S,Spot Features,
LAND,Arctic land,a tract of land in the Arctic,en,L,Area,
AREA,area,a tract of land without homogeneous character or boundaries,en,L,Area,
ISLF,artificial island,"an island created by landfill or diking and filling in a wetland, bay, or lagoon",en,T,Hypsographic,
RNGA,artillery range,a tract of land used for artillery firing practice,en,L,Area,
ASPH,asphalt lake,a small basin containing naturally occurring asphalt,en,T,Hypsographic,
ASTR,astronomical station,a point on the earth whose position has been determined by observations of celestial bodies,en,S,Spot Features,
ASYL,asylum,a facility where the insane are cared for and protected,en,S,Spot Features,
ATHF,athletic field,"a tract of land used for playing team sports, and athletic track and field events",en,S,Spot Features,
ATOL,atoll(s),a ring-shaped coral reef which has closely spaced islands on it encircling a lagoon,en,T,Hypsographic,
CTRA,atomic center,a facility where atomic research is carried out,en,S,Spot Features,
BDLD,badlands,"an area characterized by a maze of very closely spaced, deep, narrow, steep-sided ravines, and sharp crests and pinnacles",en,T,Hypsographic,
BSTN,baling station,a facility for baling agricultural products,en,S,Spot Features,
ESTB,banana plantation,an estate that specializes in the growing of bananas,en,S,Spot Features,
BAN,bank,"an establishment for the custody, loan, exchange or issue of money, for the extension of credit, and for facilitating the transmission of funds",en,S,Spot Features,
BNK,bank(s),"an elevation, typically located on a shelf, over which the depth of water is relatively shallow but sufficient for most surface navigation",en,H,Hydrographic,
BAR,bar,"a shallow ridge or mound of coarse unconsolidated material in a stream channel, at the mouth of a stream, estuary, or lagoon and in the wave-break zone along coasts",en,T,Hypsographic,
BRKS,barracks,a building for lodging military personnel,en,S,Spot Features,
BTL,battlefield,a site of a land battle of historical importance,en,L,Area,
BAY,bay,"a coastal indentation between two capes or headlands, larger than a cove but smaller than a gulf",en,H,Hydrographic,
BAYS,bays,"coastal indentations between two capes or headlands, larger than a cove but smaller than a gulf",en,H,Hydrographic,
BCH,beach,a shore zone of coarse unconsolidated sediment that extends from the low-water line to the highest reach of storm waves,en,T,Hypsographic,
RDGB,beach ridge,"a ridge of sand just inland and parallel to the beach, usually in series",en,T,Hypsographic,
BCHS,beaches,a shore zone of coarse unconsolidated sediment that extends from the low-water line to the highest reach of storm waves,en,T,Hypsographic,
BCN,beacon,a fixed artificial navigation mark,en,S,Spot Features,
BNCH,bench,"a long, narrow bedrock platform bounded by steeper slopes above and below, usually overlooking a waterbody",en,T,Hypsographic,
BGHT,bight(s),an open body of water forming a slight recession in a coastline,en,H,Hydrographic,
BLHL,blowhole(s),a hole in coastal rock through which sea water is forced by a rising tide or waves and spurted through an outlet into the air,en,T,Hypsographic,
BLOW,blowout(s),"a small depression in sandy terrain, caused by wind erosion",en,T,Hypsographic,
BTYD,boatyard,"a waterside facility for servicing, repairing, and building small vessels",en,S,Spot Features,
BOG,bog(s),"a wetland characterized by peat forming sphagnum moss, sedge, and other acid-water plants",en,H,Hydrographic,
PSTB,border post,a post or station at an international boundary for the regulation of movement of people and goods,en,S,Spot Features,
BLDR,boulder field,"a high altitude or high latitude bare, flat area covered with large angular rocks",en,T,Hypsographic,
BP,boundary marker,a fixture marking a point along a boundary,en,S,Spot Features,
BRKW,breakwater,a structure erected to break the force of waves at the entrance to a harbor or port,en,S,Spot Features,
MFGB,brewery,one or more buildings where beer is brewed,en,S,Spot Features,
BDG,bridge,"a structure erected across an obstacle such as a stream, road, etc., in order to carry roads, railroads, and pedestrians across",en,S,Spot Features,
ZNB,buffer zone,a zone recognized as a buffer between two nations in which military presence is minimal or absent,en,A,Administrative Region,
BLDG,building(s),"a structure built for permanent use, as a house, factory, etc.",en,S,Spot Features,
BUR,burial cave(s),a cave used for human burials,en,S,Spot Features,
BUSH,bush(es),a small clump of conspicuous bushes in an otherwise bare area,en,V,Vegetation,
CTRB,business center,a place where a number of businesses are located,en,L,Area,
BUTE,butte(s),"a small, isolated, usually flat-topped hill with steep sides",en,T,Hypsographic,
CARN,cairn,a heap of stones erected as a landmark or for other purposes,en,S,Spot Features,
CLDA,caldera,a depression measuring kilometers across formed by the collapse of a volcanic mountain,en,T,Hypsographic,
CMP,camp(s),"a site occupied by tents, huts, or other shelters for temporary use",en,S,Spot Features,
CNL,canal,an artificial watercourse,en,H,Hydrographic,
CNLB,canal bend,a conspicuously curved or bent section of a canal,en,H,Hydrographic,
TNLC,canal tunnel,a tunnel through which a canal passes,en,H,Hydrographic,
STMC,canalized stream,"a stream that has been substantially ditched, diked, or straightened",en,H,Hydrographic,
MFGC,cannery,a building where food items are canned,en,S,Spot Features,
CNYN,canyon,"a deep, narrow valley with steep sides cutting into a plateau or mountainous area",en,T,Hypsographic,
CAPE,cape,"a land area, more prominent than a point, projecting into the sea and marking a notable change in coastal direction",en,T,Hypsographic,
PPLC,capital of a political entity,capital of a political entity,en,P,Populated Place,
RTE,caravan route,the route taken by caravans,en,R,Streets/Highways/Roads,
CSNO,casino,"a building used for entertainment, especially gambling",en,S,Spot Features,
CSTL,castle,a large fortified building or set of buildings,en,S,Spot Features,
TNKD,cattle dipping tank,a small artificial pond used for immersing cattle in chemically treated water for disease control,en,S,Spot Features,
CSWY,causeway,a raised roadway across wet ground or shallow water,en,R,Streets/Highways/Roads,
CAVE,cave(s),"an underground passageway or chamber, or cavity on the side of a cliff",en,S,Spot Features,
CMTY,cemetery,a burial place or ground,en,S,Spot Features,
CHN,channel,"the deepest part of a stream, bay, lagoon, or strait, through which the main current flows",en,H,Hydrographic,
MNCR,chrome mine(s),a mine where chrome ore is extracted,en,S,Spot Features,
CH,church,a building for public Christian worship,en,S,Spot Features,
CRQ,cirque,a bowl-like hollow partially surrounded by cliffs or steep slopes at the head of a glaciated valley,en,T,Hypsographic,
CRQS,cirques,bowl-like hollows partially surrounded by cliffs or steep slopes at the head of a glaciated valley,en,T,Hypsographic,
CLG,clearing,an area in a forest with trees removed,en,L,Area,
CFT,cleft(s),"a deep narrow slot, notch, or groove in a coastal cliff",en,T,Hypsographic,
CLF,cliff(s),"a high, steep to perpendicular slope overlooking a waterbody or lower area",en,T,Hypsographic,
HSPC,clinic,a medical facility associated with a hospital for outpatients,en,S,Spot Features,
MNC,coal mine(s),a mine where coal is extracted,en,S,Spot Features,
COLF,coalfield,a region in which coal deposits of possible economic value occur,en,L,Area,
CST,coast,a zone of variable width straddling the shoreline,en,L,Area,
STNC,coast guard station,a facility from which the coast is guarded by armed vessels,en,S,Spot Features,
GRVC,coconut grove,a planting of coconut trees,en,V,Vegetation,
SCHC,college,the grounds and buildings of an institution of higher learning,en,S,Spot Features,
CMN,common,a park or pasture for community use,en,L,Area,
COMC,communication center,"a facility, including buildings, antennae, towers and electronic equipment for receiving and transmitting information",en,S,Spot Features,
CTRCM,community center,a facility for community recreation and other activities,en,S,Spot Features,
CNS,concession area,"a lease of land by a government for economic development, e.g., mining, forestry",en,L,Area,
CONE,cone(s),a conical landform composed of mud or volcanic material,en,T,Hypsographic,
CNFL,confluence,a place where two or more streams or intermittent streams flow together,en,H,Hydrographic,
CRSU,continental rise,a gentle slope rising from oceanic depths towards the foot of a continental slope,en,U,Undersea,
CVNT,convent,a building where a community of nuns lives in seclusion,en,S,Spot Features,
MNCU,copper mine(s),a mine where copper ore is extracted,en,S,Spot Features,
MFGCU,copper works,a facility for processing copper ore,en,S,Spot Features,
RFC,coral reef(s),a surface-navigation hazard composed of coral,en,H,Hydrographic,
CRRL,corral(s),a pen or enclosure for confining or capturing animals,en,S,Spot Features,
CRDR,corridor,a strip or area of land having significance as an access way,en,T,Hypsographic,
ESTC,cotton plantation,an estate specializing in the cultivation of cotton,en,S,Spot Features,
HSEC,country house,"a large house, mansion, or chateau, on a large estate",en,S,Spot Features,
CTHSE,courthouse,a building in which courts of law are held,en,S,Spot Features,
COVE,cove(s),"a small coastal indentation, smaller than a bay",en,H,Hydrographic,
LKC,crater lake,a lake in a crater or caldera,en,H,Hydrographic,
LKSC,crater lakes,lakes in a crater or caldera,en,H,Hydrographic,
CRTR,crater(s),a generally circular saucer or bowl-shaped depression caused by volcanic or meteorite explosive action,en,T,Hypsographic,
CUET,cuesta(s),an asymmetric ridge formed on tilted strata,en,T,Hypsographic,
CULT,cultivated area,an area under cultivation,en,V,Vegetation,
CRNT,current,a horizontal flow of water in a given direction with uniform velocity,en,H,Hydrographic,
CSTM,customs house,"a building in a port where customs and duties are paid, and where vessels are entered and cleared",en,S,Spot Features,
PSTC,customs post,a building at an international boundary where customs and duties are paid on goods,en,S,Spot Features,
CUTF,cutoff,a channel formed as a result of a stream cutting through a meander neck,en,H,Hydrographic,
DARY,dairy,"a facility for the processing, sale and distribution of milk or milk products",en,S,Spot Features,
DAM,dam,a barrier constructed across a stream to impound water,en,S,Spot Features,
DEPU,deep,"a localized deep area within the confines of a larger feature, such as a trough, basin or trench",en,U,Undersea,
DLTA,delta,a flat plain formed by alluvial deposits at the mouth of a stream,en,T,Hypsographic,
PCLD,dependent political entity,dependent political entity,en,A,Administrative Region,
DPR,depression(s),a low area surrounded by higher land and usually characterized by interior drainage,en,T,Hypsographic,
DSRT,desert,a large area with little or no vegetation due to extreme environmental conditions,en,T,Hypsographic,
PPLW,destroyed populated place,"a village, town or city destroyed by a natural disaster, or by war",en,P,Populated Place,
MNDT,diatomite mine(s),a place where diatomaceous earth is extracted,en,S,Spot Features,
DIKE,dike,an earth or stone embankment usually constructed for flood or stream control,en,S,Spot Features,
DIP,diplomatic facility,"office, residence, or facility of a foreign government, which may include an embassy, consulate, chancery, office of charge d’affaires, or other diplomatic, economic, military, or cultural mission",en,S,Spot Features,
HSPD,dispensary,a building where medical or dental aid is dispensed,en,S,Spot Features,
STMD,distributary(-ies),"a branch which flows away from the main stream, as in a delta or irrigation canal",en,H,Hydrographic,
DTCH,ditch,a small artificial watercourse dug for draining or irrigating the land,en,H,Hydrographic,
DTCHM,ditch mouth(s),"an area where a drainage ditch enters a lagoon, lake or bay",en,H,Hydrographic,
DVD,divide,a line separating adjacent drainage basins,en,T,Hypsographic,
DCK,dock(s),"a waterway between two piers, or cut into the land for the berthing of ships",en,H,Hydrographic,
DCKB,docking basin,a part of a harbor where ships dock,en,H,Hydrographic,
DCKY,dockyard,"a facility for servicing, building, or repairing ships",en,S,Spot Features,
BSND,drainage basin,an area drained by a stream,en,L,Area,
CNLD,drainage canal,an artificial waterway carrying water away from a wetland or from drainage ditches,en,H,Hydrographic,
DTCHD,drainage ditch,a ditch which serves to drain the land,en,H,Hydrographic,
DCKD,dry dock,"a dock providing support for a vessel, and means for removing the water so that the bottom of the vessel can be exposed",en,S,Spot Features,
SBED,dry stream bed,a channel formerly containing the water of a stream,en,T,Hypsographic,
DUNE,dune(s),"a wave form, ridge or star shape feature composed of sand",en,T,Hypsographic,
RGNE,economic region,a region of a country established for economic development or for statistical purposes,en,L,Area,
SCRP,escarpment,a long line of cliffs or steep slopes separating level surfaces above and below,en,T,Hypsographic,
EST,estate(s),a large commercialized agricultural landholding with associated buildings and other facilities,en,S,Spot Features,
ESTY,estuary,a funnel-shaped stream mouth or embayment where fresh water mixes with sea water under tidal influences,en,H,Hydrographic,
STNE,experiment station,a facility for carrying out experiments,en,S,Spot Features,
FCL,facility,"a building or buildings housing a center, institute, foundation, hospital, prison, mission, courthouse, etc.",en,S,Spot Features,
CTRF,facility center,a place where more than one facility is situated,en,S,Spot Features,
MFG,factory,"one or more buildings where goods are manufactured, processed or fabricated",en,S,Spot Features,
FAN,fan(s),a fan-shaped wedge of coarse alluvium with apex merging with a mountain stream bed and the fan spreading out at a low angle slope onto an adjacent plain,en,T,Hypsographic,
FRM,farm,a tract of land with associated buildings devoted to agriculture,en,S,Spot Features,
PPLF,farm village,a populated place where the population is largely engaged in agricultural activities,en,P,Populated Place,
FRMS,farms,tracts of land with associated buildings devoted to agriculture,en,S,Spot Features,
FRMT,farmstead,the buildings and adjacent service areas of a farm,en,S,Spot Features,
FY,ferry,a boat or other floating conveyance and terminal facilities regularly used to transport people and vehicles across a waterbody,en,S,Spot Features,
FYT,ferry terminal,"a place where ferries pick-up and discharge passengers, vehicles and or cargo",en,S,Spot Features,
FLD,field(s),an open as opposed to wooded area,en,L,Area,
FIRE,fire station,building housing firefighters and/or fire fighting equipment,en,S,Spot Features,
ADM1,first-order administrative division,"a primary administrative division of a country, such as a state in the United States",en,A,Administrative Region,
FISH,fishing area,"a fishing ground, bank or area where fishermen go to catch fish",en,H,Hydrographic,
PNDSF,fishponds,ponds or enclosures in which fish are kept or raised,en,H,Hydrographic,
FSR,fissure,a crack associated with volcanism,en,T,Hypsographic,
FJD,fjord,"a long, narrow, steep-walled, deep-water arm of the sea at high latitudes, usually along mountainous coasts",en,H,Hydrographic,
FJDS,fjords,"long, narrow, steep-walled, deep-water arms of the sea at high latitudes, usually along mountainous coasts",en,H,Hydrographic,
FORD,ford,a shallow part of a stream which can be crossed on foot or by land vehicle,en,T,Hypsographic,
RESF,forest reserve,a forested area set aside for preservation or controlled use,en,L,Area,
STNF,forest station,a collection of buildings and facilities for carrying out forest management,en,S,Spot Features,
FRST,forest(s),an area dominated by tree vegetation,en,V,Vegetation,
INLTQ,former inlet,"an inlet which has been filled in, or blocked by deposits",en,H,Hydrographic,
MLSGQ,former sugar mill,a sugar mill no longer used as a sugar mill,en,S,Spot Features,
FT,fort,a defensive structure or earthworks,en,S,Spot Features,
FRSTF,fossilized forest,a forest fossilized by geologic processes and now exposed at the earth's surface,en,V,Vegetation,
FNDY,foundry,a building or works where metal casting is carried out,en,S,Spot Features,
ADM4,fourth-order administrative division,a subdivision of a third-order administrative division,en,A,Administrative Region,
ZNF,free trade zone,"an area, usually a section of a port, where goods may be received and shipped free of customs duty and of most customs regulations",en,S,Spot Features,
PCLF,freely associated state,freely associated state,en,A,Administrative Region,
DPOF,fuel depot,an area where fuel is stored,en,S,Spot Features,
GAP,gap,"a low place in a ridge, not used for transportation",en,T,Hypsographic,
GDN,garden(s),an enclosure for displaying selected plant or animal life,en,S,Spot Features,
GOSP,gas-oil separator plant,a facility for separating gas from oil,en,S,Spot Features,
GASF,gasfield,an area containing a subterranean store of natural gas of economic value,en,L,Area,
GATE,gate,a controlled access entrance or exit,en,S,Spot Features,
GYSR,geyser,a type of hot spring with intermittent eruptions of jets of hot water and steam,en,H,Hydrographic,
GHAT,ghāt,"a set of steps leading to a river, which are of religious significance, and at their base is usually a platform for bathing",en,S,Spot Features,
GLCR,glacier(s),"a mass of ice, usually at high latitudes or high elevations, with sufficient thickness to flow away from the source area in lobes, tongues, or masses",en,H,Hydrographic,
MNAU,gold mine(s),"a mine where gold ore, or alluvial gold is extracted",en,S,Spot Features,
RECG,golf course,a recreation field where golf is played,en,S,Spot Features,
GRGE,gorge(s),"a short, narrow, steep-sided section of a stream valley",en,T,Hypsographic,
GRSLD,grassland,an area dominated by grass vegetation,en,V,Vegetation,
GRVE,grave,a burial site,en,S,Spot Features,
GVL,gravel area,an area covered with gravel,en,L,Area,
GRAZ,grazing area,an area of grasses and shrubs used for grazing,en,L,Area,
GHSE,guest house,a house used to provide lodging for paying guests,en,S,Spot Features,
GULF,gulf,"a large recess in the coastline, larger than a bay",en,H,Hydrographic,
HLT,halting place,a place where caravans stop for rest,en,S,Spot Features,
HMCK,hammock(s),"a patch of ground, distinct from and slightly above the surrounding plain or wetland. Often occurs in groups",en,T,Hypsographic,
AIRG,hangar,a covered and usually enclosed area for housing and repairing aircraft,en,S,Spot Features,
VALG,hanging valley,a valley the floor of which is notably higher than the valley or shore to which it leads; most common in areas that have been glaciated,en,T,Hypsographic,
HBR,harbor(s),a haven or space of deep water so sheltered by the adjacent land as to afford a safe anchorage for ships,en,H,Hydrographic,
HDLD,headland,a high projection of land extending into a large body of water beyond the line of the coast,en,T,Hypsographic,
STMH,headwaters,"the source and upper part of a stream, including the upper drainage basin",en,H,Hydrographic,
HTH,heath,an upland moor or sandy area dominated by low shrubby vegetation including heather,en,V,Vegetation,
AIRH,heliport,a place where helicopters land and take off,en,S,Spot Features,
HERM,hermitage,"a secluded residence, usually for religious sects",en,S,Spot Features,
HLL,hill,a rounded elevation of limited extent rising above the surrounding land with local relief of less than 300m,en,T,Hypsographic,
HLLS,hills,rounded elevations of limited extent rising above the surrounding land with local relief of less than 300m,en,T,Hypsographic,
ADMDH,historical administrative division,"a former administrative division of a political entity, undifferentiated as to administrative level",en,A,Administrative Region,
ADM1H,historical first-order administrative division,a former first-order administrative division,en,A,Administrative Region,
ADM4H,historical fourth-order administrative division,a former fourth-order administrative division,en,A,Administrative Region,
PCLH,historical political entity,a former political entity,en,A,Administrative Region,
PPLH,historical populated place,a populated place that no longer exists,en,P,Populated Place,
RRH,historical railroad,a former permanent twin steel-rail track on which freight and passenger cars move long distances,en,R,Streets/Highways/Roads,
RSTNH,historical railroad station,"a former facility comprising ticket office, platforms, etc. for loading and unloading train passengers and freight",en,S,Spot Features,
RGNH,historical region,a former area distinguished by one or more observable physical or cultural characteristics,en,L,Area,
ADM2H,historical second-order administrative division,a former second-order administrative division,en,A,Administrative Region,
HSTS,historical site,a place of historical importance,en,S,Spot Features,
ADM3H,historical third-order administrative division,a former third-order administrative division,en,A,Administrative Region,
UFHU,historical undersea feature,an undersea feature whose existence has been subsequently disproved,en,U,Undersea,
HMSD,homestead,"a residence, owner's or manager's, on a sheep or cattle station, woolshed, outcamp, or Aboriginal outstation, specific to Australia and New Zealand",en,S,Spot Features,
HSP,hospital,"a building in which sick or injured, especially those confined to bed, are medically treated",en,S,Spot Features,
SPNT,hot spring(s),a place where hot ground water flows naturally out of the ground,en,H,Hydrographic,
HTL,hotel,a building providing lodging and/or meals for the public,en,S,Spot Features,
HSE,house(s),a building used as a human habitation,en,S,Spot Features,
DEVH,housing development,a tract of land on which many houses of similar design are built according to a development plan,en,L,Area,
RESH,hunting reserve,a tract of land used primarily for hunting,en,L,Area,
HUT,hut,a small primitive house,en,S,Spot Features,
HUTS,huts,small primitive houses,en,S,Spot Features,
