code,name,description,category,url,status
STMGS,stream gauging station,"named place where a measuring station for a watercourse, reservoir or other water body exists",S,,active
STMM,stream mouth(s),"a place where a stream discharges into a lagoon, lake, or the sea",H,,active
STMS,streams,bodies of running water moving to a lower level in a channel on land,H,,active
ST,street,a paved urban thoroughfare,R,,active
DAMSB,sub-surface dam,a dam put down to bedrock in a sand river,S,,active
SUBW,subway,"a railroad used for mass public transportation primarily in urban areas, all or part of the system may be located below, above, or at ground level",S,,active
SUBS,subway station,"a facility comprising ticket office, platforms, etc. for loading and unloading subway passengers",S,,active
MLSG,sugar mill,a facility where sugar cane is processed into raw sugar,S,,active
ESTSG,sugar plantation,an estate that specializes in growing sugar cane,S,,active
MFGSG,sugar refinery,a facility for converting raw sugar into refined sugar,S,,active
SPNS,sulphur spring(s),a place where sulphur ground water flows naturally out of the ground,H,,active
SWMP,swamp,a wetland dominated by tree vegetation,H,,active
SYG,synagogue,a place for Jewish worship and religious instruction,S,,active
TMTU,tablemount (or guyot),"a seamount having a comparatively smooth, flat top",U,,active
TMSU,tablemounts (or guyots),"seamounts having a comparatively smooth, flat top",U,,active
TAL,talus slope,a steep concave slope formed by an accumulation of loose rock fragments at the base of a cliff or steep slope,T,,active
OILT,tank farm,"a tract of land occupied by large, cylindrical, metal tanks in which oil or liquid petrochemicals are stored",S,,active
ESTT,tea plantation,an estate which specializes in growing tea bushes,S,,active
SCHT,technical school,post-secondary school with a specifically technical or vocational curriculum,S,,active
TMPL,temple(s),an edifice dedicated to religious worship,S,,active
AIRT,terminal,airport facilities for the handling of freight and passengers,S,,active
TRR,terrace,"a long, narrow alluvial platform bounded by steeper slopes above and below, usually overlooking a waterbody",T,,active
TERR,territory,territory,A,,active
ADM3,third-order administrative division,a subdivision of a second-order administrative division,A,,active
CRKT,tidal creek(s),a meandering channel in a coastal wetland subject to bi-directional tidal currents,H,,active
FLTT,tidal flat(s),a large flat area of mud or sand attached to the shore and alternately covered and uncovered by the tide,H,,active
MNSN,tin mine(s),a mine where tin ore is extracted,S,,active
TOLL,toll gate/barrier,highway toll collection station,S,,active
TMB,tomb(s),a structure for interring bodies,S,,active
TOWR,tower,"a high conspicuous structure, typically much higher than its diameter",S,,active
RDCR,traffic circle,a road junction formed around a central circle about which traffic moves in one direction only,S,,active
TRL,trail,"a path, track, or route used by pedestrians, animals, or off-road vehicles",R,,active
TRANT,transit terminal,facilities for the handling of vehicular freight and passengers,S,,active
TREE,tree(s),a conspicuous tree used as a landmark,V,,active
TRIG,triangulation station,a point on the earth whose position has been determined by triangulation,S,,active
TRB,tribal area,a tract of land used by nomadic or other tribes,L,,active
TUND,tundra,"a marshy, treeless, high latitude plain, dominated by mosses, lichens, and low shrub vegetation under permafrost conditions",V,,active
TNL,tunnel,a subterranean passageway for transportation,R,,active
TNLS,tunnels,subterranean passageways for transportation,R,,active
CNLSB,underground irrigation canal(s),a gently inclined underground tunnel bringing water for irrigation from aquifers,H,,active
LKSB,underground lake,a standing body of water in a cave,H,,active
APNU,undersea apron,"a gentle slope, with a generally smooth surface, particularly found around groups of islands and seamounts",U,,active
ARCU,undersea arch,a low bulge around the southeastern end of the island of Hawaii,U,,active
ARRU,undersea arrugado,an area of subdued corrugations off Baja California,U,,active
BNKU,undersea bank,"an elevation, typically located on a shelf, over which the depth of water is relatively shallow but sufficient for safe surface navigation",U,,active
BKSU,undersea banks,"elevations, typically located on a shelf, over which the depth of water is relatively shallow but sufficient for safe surface navigation",U,,active
BSNU,undersea basin,a depression more or less equidimensional in plan and of variable extent,U,,active
BNCU,undersea bench,a small terrace,U,,active
BDLU,undersea borderland,"a region adjacent to a continent, normally occupied by or bordering a shelf, that is highly irregular with depths well in excess of those typical of a shelf",U,,active
CNYU,undersea canyon,"a relatively narrow, deep depression with steep sides, the bottom of which generally has a continuous slope",U,,active
CNSU,undersea canyons,"relatively narrow, deep depressions with steep sides, the bottom of which generally has a continuous slope",U,,active
CDAU,undersea cordillera,"an entire mountain system including the subordinate ranges, interior plateaus, and basins",U,,active
ESCU,undersea escarpment (or scarp),an elongated and comparatively steep slope separating flat or gently sloping areas,U,,active
FANU,undersea fan,a relatively smooth feature normally sloping away from the lower termination of a canyon or canyon system,U,,active
FLTU,undersea flat,a small level or nearly level area,U,,active
FRKU,undersea fork,a branch of a canyon or valley,U,,active
FRSU,undersea forks,a branch of a canyon or valley,U,,active
FRZU,undersea fracture zone,"an extensive linear zone of irregular topography of the sea floor, characterized by steep-sided or asymmetrical ridges, troughs, or escarpments",U,,active
FURU,undersea furrow,"a closed, linear, narrow, shallow depression",U,,active
GAPU,undersea gap,a narrow break in a ridge or rise,U,,active
GLYU,undersea gully,a small valley-like feature,U,,active
HLLU,undersea hill,an elevation rising generally less than 500 meters,U,,active
HLSU,undersea hills,elevations rising generally less than 500 meters,U,,active
HOLU,undersea hole,a small depression of the sea floor,U,,active
KNLU,undersea knoll,"an elevation rising generally more than 500 meters and less than 1,000 meters and of limited extent across the summit",U,,active
KNSU,undersea knolls,"elevations rising generally more than 500 meters and less than 1,000 meters and of limited extent across the summits",U,,active
LDGU,undersea ledge,"a rocky projection or outcrop, commonly linear and near shore",U,,active
LEVU,undersea levee,"an embankment bordering a canyon, valley, or seachannel",U,,active
MDVU,undersea median valley,the axial depression of the mid-oceanic ridge system,U,,active
MESU,undersea mesa,"an isolated, extensive, flat-topped elevation on the shelf, with relatively steep sides",U,,active
MOTU,undersea moat,"an annular depression that may not be continuous, located at the base of many seamounts, islands, and other isolated elevations",U,,active
MNDU,undersea mound,"a low, isolated, rounded hill",U,,active
MTU,undersea mountain,a well-delineated subdivision of a large and complex positive feature,U,,active
MTSU,undersea mountains,well-delineated subdivisions of a large and complex positive feature,U,,active
PKU,undersea peak,"a prominent elevation, part of a larger feature, either pointed or of very limited extent across the summit",U,,active
PKSU,undersea peaks,"prominent elevations, part of a larger feature, either pointed or of very limited extent across the summit",U,,active
PNLU,undersea pinnacle,"a high tower or spire-shaped pillar of rock or coral, alone or cresting a summit",U,,active
PLNU,undersea plain,"a flat, gently sloping or nearly level region",U,,active
PLTU,undersea plateau,"a comparatively flat-topped feature of considerable extent, dropping off abruptly on one or more sides",U,,active
PLFU,undersea platform,a flat or gently sloping underwater surface extending seaward from the shore,U,,active
PRVU,undersea province,a region identifiable by a group of similar physiographic features whose characteristics are markedly in contrast with surrounding areas,U,,active
RMPU,undersea ramp,a gentle slope connecting areas of different elevations,U,,active
RNGU,undersea range,a series of associated ridges or seamounts,U,,active
RAVU,undersea ravine,a small canyon,U,,active
RFU,undersea reef,a surface-navigation hazard composed of consolidated material,U,,active
RFSU,undersea reefs,surface-navigation hazards composed of consolidated material,U,,active
RDGU,undersea ridge,a long narrow elevation with steep sides,U,,active
RDSU,undersea ridges,long narrow elevations with steep sides,U,,active
RISU,undersea rise,"a broad elevation that rises gently, and generally smoothly, from the sea floor",U,,active
SDLU,undersea saddle,"a low part, resembling in shape a saddle, in a ridge or between contiguous seamounts",U,,active
SHFU,undersea shelf,a zone adjacent to a continent (or around an island) that extends from the low water line to a depth at which there is usually a marked increase of slope towards oceanic depths,U,,active
EDGU,undersea shelf edge,a line along which there is a marked increase of slope at the outer margin of a continental shelf or island shelf,U,,active
SHVU,undersea shelf valley,"a valley on the shelf, generally the shoreward extension of a canyon",U,,active
SHLU,undersea shoal,a surface-navigation hazard composed of unconsolidated material,U,,active
SHSU,undersea shoals,hazards to surface navigation composed of unconsolidated material,U,,active
SILU,undersea sill,"the low part of an underwater gap or saddle separating basins, including a similar feature at the mouth of a fjord",U,,active
SLPU,undersea slope,the slope seaward from the shelf edge to the beginning of a continental rise or the point where there is a general reduction in slope,U,,active
SPRU,undersea spur,"a subordinate elevation, ridge, or rise projecting outward from a larger feature",U,,active
TERU,undersea terrace,"a relatively flat horizontal or gently inclined surface, sometimes long and narrow, which is bounded by a steeper ascending slope on one side and by a steep descending slope on the opposite side",U,,active
TNGU,undersea tongue,an elongate (tongue-like) extension of a flat sea floor into an adjacent higher feature,U,,active
TRNU,undersea trench,"a long, narrow, characteristically very deep and asymmetrical depression of the sea floor, with relatively steep sides",U,,active
TRGU,undersea trough,"a long depression of the sea floor characteristically flat bottomed and steep sided, and normally shallower than a trench",U,,active
VALU,undersea valley,"a relatively shallow, wide depression, the bottom of which usually has a continuous gradient",U,,active
VLSU,undersea valleys,"a relatively shallow, wide depression, the bottom of which usually has a continuous gradient",U,,active
USGE,United States Government Establishment,a facility operated by the United States Government in Panama,S,,active
UPLD,upland,an extensive interior region of high land with low to moderate surface relief,T,,active
VAL,valley,an elongated depression usually traversed by a stream,T,,active
VALS,valleys,elongated depressions usually traversed by a stream,T,,active
VETF,veterinary facility,a building or camp at which veterinary services are available,S,,active
VIN,vineyard,a planting of grapevines,V,,active
VINS,vineyards,plantings of grapevines,V,,active
VLC,volcano,a conical elevation composed of volcanic materials with a crater at the top,T,,active
WAD,wadi,"a valley or ravine, bounded by relatively steep banks, which in the rainy season becomes a watercourse; found primarily in North Africa and the Middle East",H,,active
WADB,wadi bend,a conspicuously curved or bent segment of a wadi,H,,active
WADJ,wadi junction,a place where two or more wadies join,H,,active
WADM,wadi mouth,"the lower terminus of a wadi where it widens into an adjoining floodplain, depression, or waterbody",H,,active
WADS,wadies,"valleys or ravines, bounded by relatively steep banks, which in the rainy season become watercourses; found primarily in North Africa and the Middle East",H,,active
WALL,wall,"a thick masonry structure, usually enclosing a field or building, or forming the side of a structure",S,,active
MLWTR,water mill,a mill powered by running water,S,,active
PMPW,water pumping station,a facility for pumping water from a major well or through a pipeline,S,,active
RSVT,water tank,"a contained pool or tank of water at, below, or above ground level",H,,active
WTRC,watercourse,"a natural, well-defined channel produced by flowing water, or an artificial channel designed to carry flowing water",H,,active
FLLS,waterfall(s),a perpendicular or very steep descent of the water of a stream,H,,active
WTRH,waterhole(s),"a natural hole, hollow, or small depression that contains water, used by man and animals, especially in arid areas",H,,active
WTRW,waterworks,a facility for supplying potable water through a water source and a system of pumps and filtration beds,S,,active
WEIR,weir(s),"a small dam in a stream, designed to raise the water level or to divert stream flow through a desired channel",S,,active
WLL,well,"a cylindrical hole, pit, or tunnel drilled or dug down to a depth from which water, oil, or gas can be pumped or brought to the surface",H,,active
WLLS,wells,"cylindrical holes, pits, or tunnels drilled or dug down to a depth from which water, oil, or gas can be pumped or brought to the surface",H,,active
WTLD,wetland,"an area subject to inundation, usually characterized by bog, marsh, or swamp vegetation",H,,active
STNW,whaling station,a facility for butchering whales and processing train oil,S,,active
WHRF,wharf(-ves),a structure of open rather than solid construction along a shore or a bank which provides berthing for ships and cargo-handling facilities,S,,active
WHRL,whirlpool,"a turbulent, rotating movement of water in a stream",H,,active
RESW,wildlife reserve,a tract of public land reserved for the preservation of wildlife,L,,active
MLWND,windmill,a mill or water pump powered by wind,S,,active
WRCK,wreck,the site of the remains of a wrecked vessel,S,,active
ZN,zone,zone,A,,active
ZOO,zoo,a zoological garden or park where wild animals are kept for exhibition,S,,active
