code,name,description,category,url,status
SYSI,irrigation system,"a network of ditches and one or more of the following elements: water supply, reservoir, canal, pump, well, drain, etc.",H,,active
ISL,island,"a tract of land, smaller than a continent, surrounded by water at high water",T,,active
ISLS,islands,"tracts of land, smaller than a continent, surrounded by water at high water",T,,active
STLMT,Israeli settlement,Israeli settlement,P,,active
ISTH,isthmus,a narrow strip of land connecting two larger land masses and bordered by water,T,,active
JTY,jetty,a structure built out into the water at a river mouth or harbor entrance to regulate currents and silting,S,,active
KRST,karst area,"a distinctive landscape developed on soluble rock such as limestone characterized by sinkholes, caves, disappearing streams, and underground drainage",T,,active
CMPLA,labor camp,a camp used by migrant or temporary laborers,S,,active
LGN,lagoon,"a shallow coastal waterbody, completely or partly separated from a larger body of water by a barrier island, coral reef or other depositional feature",H,,active
LGNS,lagoons,"shallow coastal waterbodies, completely or partly separated from a larger body of water by a barrier island, coral reef or other depositional feature",H,,active
LK,lake,a large inland body of standing water,H,,active
LBED,lake bed(s),a dried up or drained area of a former lake,H,,active
CHNL,lake channel(s),"that part of a lake having water deep enough for navigation between islands, shoals, etc.",H,,active
RGNL,lake region,a tract of land distinguished by numerous lakes,L,,active
LKS,lakes,large inland bodies of standing water,H,,active
ISLT,land-tied island,"a coastal island connected to the mainland by barrier beaches, levees or dikes",T,,active
LNDF,landfill,a place for trash and garbage disposal in which the waste is buried between layers of earth to build up low-lying land,S,,active
LDNG,landing,"a place where boats receive or discharge passengers and freight, but lacking most port facilities",S,,active
LAVA,lava area,an area of solidified lava,T,,active
MNPB,lead mine(s),a mine where lead ore is extracted,S,,active
LTER,leased area,a tract of land leased by the United Kingdom from the People's Republic of China to form part of Hong Kong,A,,active
LEPC,leper colony,a settled area inhabited by lepers in relative isolation,S,,active
HSPL,leprosarium,an asylum or hospital for lepers,S,,active
LEV,levee,a natural low embankment bordering a distributary or meandering stream; often built up artificially to control floods,T,,active
LTHSE,lighthouse,a distinctive structure exhibiting a major navigation light,S,,active
MFGLM,limekiln,a furnace in which limestone is reduced to lime,S,,active
GOVL,local government office,"a facility housing local governmental offices, usually a city, town, or village hall",S,,active
LCTY,locality,a minor area or place of unspecified or mixed character and indefinite boundaries,L,,active
LOCK,lock(s),a basin in a waterway with gates at each end by means of which vessels are passed from one water level to another,S,,active
CMPL,logging camp,a camp used by loggers,S,,active
STMSB,lost river,"a surface stream that disappears into an underground channel, or dries up in an arid area",H,,active
MVA,maneuver area,a tract of land where military field exercises are carried out,L,,active
ISLM,mangrove island,a mangrove swamp surrounded by a waterbody,T,,active
MGV,mangrove swamp,a tropical tidal mud flat characterized by mangrove vegetation,H,,active
MAR,marina,"a harbor facility for small boats, yachts, etc.",S,,active
CHNM,marine channel,that part of a body of water deep enough for navigation through an area otherwise not suitable,H,,active
SCHN,maritime school,a school at which maritime sciences form the core of the curriculum,S,,active
MKT,market,a place where goods are bought and sold at regular intervals,S,,active
MRSH,marsh(es),a wetland dominated by grass-like vegetation,H,,active
MDW,meadow,"a small, poorly drained area dominated by grassy vegetation",V,,active
NKM,meander neck,a narrow strip of land between the two limbs of a meander loop at its narrowest point,T,,active
CTRM,medical center,"a complex of health care buildings including two or more of the following: hospital, medical school, clinic, pharmacy, doctor's offices, etc.",S,,active
MESA,mesa(s),"a flat-topped, isolated elevation with steep slopes on all sides, less extensive than a plateau",T,,active
STNM,meteorological station,a station at which weather elements are recorded,S,,active
MILB,military base,"a place used by an army or other armed service for storing arms and supplies, and for accommodating and training troops, a base from which operations can be initiated",L,,active
INSM,military installation,a facility for use of and control by armed forces,S,,active
SCHM,military school,a school at which military science forms the core of the curriculum,S,,active
ML,mill(s),"a building housing machines for transforming, shaping, finishing, grinding, or extracting products",S,,active
MN,mine(s),a site where mineral ores are extracted from the ground by excavating surface pits and subterranean passages,S,,active
MNA,mining area,an area of mine sites where minerals and ores are extracted,L,,active
CMPMN,mining camp,a camp used by miners,S,,active
MSSN,mission,"a place characterized by dwellings, school, church, hospital and other facilities operated by a religious group for the purpose of providing charitable services and to propagate religion",S,,active
MOLE,mole,a massive structure of masonry or large stones serving as a pier or breakwater,S,,active
MSTY,monastery,a building and grounds where a community of monks lives in seclusion,S,,active
MNMT,monument,a commemorative structure or statue,S,,active
MOOR,moor(s),an area of open ground overlaid with wet peaty soils,H,,active
MRN,moraine,"a mound, ridge, or other accumulation of glacial till",T,,active
MSQE,mosque,a building for public Islamic worship,S,,active
MND,mound(s),"a low, isolated, rounded hill",T,,active
MT,mountain,"an elevation standing high above the surrounding area with small summit area, steep slopes and local relief of 300m or more",T,,active
MTS,mountains,a mountain range or a group of mountains or high ridges,T,,active
FLTM,mud flat(s),"a relatively level area of mud either between high and low tide lines, or subject to flooding",H,,active
MFGM,munitions plant,a factory where ammunition is made,S,,active
MUS,museum,a building where objects of permanent interest in one or more of the arts and sciences are preserved and exhibited,S,,active
NRWS,narrows,"a navigable narrow part of a bay, strait, river, etc.",H,,active
TNLN,natural tunnel,a cave that is open at both ends,R,,active
RESN,nature reserve,an area reserved for the maintenance of a natural habitat,L,,active
NVB,naval base,"an area used to store supplies, provide barracks for troops and naval personnel, a port for naval vessels, and from which operations are initiated",L,,active
CNLN,navigation canal(s),a watercourse constructed for navigation of vessels,H,,active
CHNN,navigation channel,a buoyed channel of sufficient depth for the safe navigation of vessels,H,,active
MNNI,nickel mine(s),a mine where nickel ore is extracted,S,,active
NOV,novitiate,a religious house or school where novices are trained,S,,active
PSN,nuclear power station,nuclear power station,S,,active
NTK,nunatak,a rock or mountain peak protruding through glacial ice,T,,active
NTKS,nunataks,rocks or mountain peaks protruding through glacial ice,T,,active
NSY,nursery(-ies),a place where plants are propagated for transplanting or grafting,S,,active
OAS,oasis(-es),an area in a desert made productive by the availability of water,L,,active
OBPT,observation point,a wildlife or scenic observation point,S,,active
OBS,observatory,a facility equipped for observation of atmospheric or space phenomena,S,,active
OCN,ocean,one of the major divisions of the vast expanse of salt water covering part of the earth,H,,active
BLDO,office building,commercial building where business and/or services are conducted,S,,active
CMPO,oil camp,a camp used by oilfield workers,S,,active
ESTO,oil palm plantation,an estate specializing in the cultivation of oil palm trees,S,,active
OILP,oil pipeline,a pipeline used for transporting oil,R,,active
OILJ,oil pipeline junction,a section of an oil pipeline where two or more pipes join together,S,,active
TRMO,oil pipeline terminal,a tank farm or loading facility at the end of an oil pipeline,S,,active
PMPO,oil pumping station,a facility for pumping oil through a pipeline,S,,active
OILR,oil refinery,a facility for converting crude oil into refined petroleum products,S,,active
OILW,oil well,a well from which oil may be pumped,S,,active
OILF,oilfield,an area containing a subterranean store of petroleum of economic value,L,,active
GRVO,olive grove,a planting of olive trees,V,,active
MLO,olive oil mill,a mill where oil is extracted from olives,S,,active
OCH,orchard(s),a planting of fruit or nut trees,V,,active
MLM,ore treatment plant,a facility for improving the metal content of ore by concentration,S,,active
OVF,overfalls,an area of breaking waves caused by the meeting of currents or by waves moving against the current,H,,active
LKO,oxbow lake,a crescent-shaped lake commonly found adjacent to meandering streams,H,,active
PGDA,pagoda,"a tower-like storied structure, usually a Buddhist shrine",S,,active
PAL,palace,"a large stately house, often a royal or presidential residence",S,,active
GRVP,palm grove,a planting of palm trees,V,,active
RESP,palm tree reserve,an area of palm trees where use is controlled,L,,active
PAN,pan,"a near-level shallow, natural depression or basin, usually containing an intermittent lake, pond, or pool",T,,active
PANS,pans,"a near-level shallow, natural depression or basin, usually containing an intermittent lake, pond, or pool",T,,active
PRSH,parish,an ecclesiastical district,A,,active
PRK,park,"an area, often of forested land, maintained as a place of beauty, or for recreation",L,,active
PRKGT,park gate,a controlled access to a park,S,,active
PRKHQ,park headquarters,a park administrative facility,S,,active
GARG,parking garage,a building or underground facility used exclusively for parking vehicles,S,,active
PKLT,parking lot,an area used for parking vehicles,S,,active
PASS,pass,"a break in a mountain range or other high obstruction, used for transportation from one side to the other [See also gap]",T,,active
PSTP,patrol post,a post from which patrols are sent out,S,,active
PK,peak,"a pointed elevation atop a mountain, ridge, or other hypsographic feature",T,,active
PKS,peaks,"pointed elevations atop a mountain, ridge, or other hypsographic features",T,,active
PEAT,peat cutting area,an area where peat is harvested,L,,active
PEN,peninsula,an elongate area of land projecting into a body of water and nearly surrounded by water,T,,active
BSNP,petroleum basin,an area underlain by an oil-rich structural basin,L,,active
MFGPH,phosphate works,a facility for producing fertilizer,S,,active
PIER,pier,a structure built out into navigable water on piles providing berthing for ships and recreation,S,,active
GRVPN,pine grove,a planting of pine trees,V,,active
MNPL,placer mine(s),a place where heavy metals are concentrated and running water is used to extract them from unconsolidated sediments,S,,active
PLN,plain(s),"an extensive area of comparatively level to gently undulating land, lacking surface irregularities, and usually adjacent to a higher area",T,,active
PLAT,plateau,"an elevated plain with steep slopes on one or more sides, and often with incised streams",T,,active
PT,point,"a tapering piece of land projecting into a body of water, less prominent than a cape",T,,active
PTS,points,"tapering pieces of land projecting into a body of water, less prominent than a cape",T,,active
PLDR,polder,an area reclaimed from the sea by diking and draining,T,,active
PP,police post,a building in which police are stationed,S,,active
PCL,political entity,political entity,A,,active
PND,pond,a small standing waterbody,H,,active
PNDS,ponds,small standing waterbodies,H,,active
POOL,pool(s),"a small and comparatively still, deep part of a larger body of water such as a stream or harbor; or a small body of standing water",H,,active
PPLL,populated locality,an area similar to a locality but with a small group of dwellings or other buildings,P,,active
PPL,populated place,"a city, town, village, or other agglomeration of buildings where people live and work",P,,active
PPLS,populated places,"cities, towns, villages, or other agglomerations of buildings where people live and work",P,,active
PRT,port,"a place provided with terminal and transfer facilities for loading and discharging waterborne cargo or passengers, usually located in a harbor",L,,active
PTGE,portage,"a place where boats, goods, etc., are carried overland between navigable waters",R,,active
PO,post office,"a public building in which mail is received, sorted and distributed",S,,active
PS,power station,a facility for generating electric power,S,,active
PRN,prison,a facility for confining prisoners,S,,active
PRMN,promenade,"a place for public walking, usually along a beach front",R,,active
PROM,promontory(-ies),a bluff or prominent hill overlooking or projecting into a lowland,T,,active
PYR,pyramid,an ancient massive structure of square ground plan with four triangular faces meeting at a point and used for enclosing tombs,S,,active
PYRS,pyramids,ancient massive structures of square ground plan with four triangular faces meeting at a point and used for enclosing tombs,S,,active
MNQR,quarry(-ies),"a surface mine where building stone or gravel and sand, etc. are extracted",S,,active
QUAY,quay,a structure of solid construction along a shore or bank which provides berthing for ships and which generally provides cargo handling facilities,S,,active
QCKS,quicksand,"an area where loose sand with water moving through it may become unstable when heavy objects are placed at the surface, causing them to sink",L,,active
RECR,racetrack,a track where races are held,S,,active
OBSR,radio observatory,a facility equipped with an array of antennae for receiving radio waves from space,S,,active
STNR,radio station,a facility for producing and transmitting information by radio waves,S,,active
RR,railroad,a permanent twin steel-rail track on which freight and passenger cars move long distances,R,,active
RJCT,railroad junction,a place where two or more railroad tracks join,R,,active
RSD,railroad siding,a short track parallel to and joining the main track,S,,active
RSGNL,railroad signal,a signal at the entrance of a particular section of track governing the movement of trains,S,,active
RSTN,railroad station,"a facility comprising ticket office, platforms, etc. for loading and unloading train passengers and freight",S,,active
RSTP,railroad stop,a place lacking station facilities where trains stop to pick up and unload passengers and freight,S,,active
TNLRR,railroad tunnel,a tunnel through which a railroad passes,R,,active
RYD,railroad yard,"a system of tracks used for the making up of trains, and switching and storing freight cars",R,,active
RNCH,ranch(es),a large farm specializing in extensive grazing of livestock,S,,active
RPDS,rapids,"a turbulent section of a stream associated with a steep, irregular stream bed",H,,active
RVN,ravine(s),"a small, narrow, deep, steep-sided stream channel, smaller than a gorge",H,,active
RCH,reach,a straight section of a navigable stream or channel between two bends,H,,active
RF,reef(s),a surface-navigation hazard composed of consolidated material,H,,active
PRNJ,reformatory,"a facility for confining, training, and reforming young law offenders",S,,active
CMPRF,refugee camp,a camp used by refugees,S,,active
RGN,region,an area distinguished by one or more observable physical or cultural characteristics,L,,active
CTRR,religious center,"a facility where more than one religious activity is carried out, e.g., retreat, school, monastery, worship",S,,active
PPLR,religious populated place,a populated place whose population is largely engaged in religious occupations,P,,active
RLG,religious site,an ancient site of significant religious importance,S,,active
ITTR,research institute,a facility where research is carried out,S,,active
RESV,reservation,"a tract of land set aside for aboriginal, tribal, or native populations",L,,active
RES,reserve,a tract of public land reserved for future use or restricted as to use,L,,active
RSV,reservoir(s),an artificial pond or lake,H,,active
RSRT,resort,"a specialized facility for vacation, health, or participation sports activities",S,,active
RHSE,resthouse,a structure maintained for the rest and shelter of travelers,S,,active
RLGR,retreat,"a place of temporary seclusion, especially for religious groups",S,,active
RDGE,ridge(s),"a long narrow elevation with steep sides, and a more or less continuous crest",T,,active
RD,road,"an open way with improved surface for transportation of animals, people and vehicles",R,,active
RDB,road bend,a conspicuously curved or bent section of a road,R,,active
RDCUT,road cut,an excavation cut through a hill or ridge for a road,R,,active
RDJCT,road junction,a place where two or more roads join,R,,active
TNLRD,road tunnel,a tunnel through which a road passes,R,,active
RDST,roadstead,an open anchorage affording less protection than a harbor,H,,active
RK,rock,"a conspicuous, isolated rocky mass",T,,active
HMDA,rock desert,"a relatively sand-free, high bedrock plateau in a hot desert, with or without a gravel veneer",T,,active
RKFL,rockfall,an irregular mass of fallen rock at the base of a cliff or steep slope,T,,active
RKS,rocks,"conspicuous, isolated rocky masses",T,,active
RKRY,rookery,a breeding place of a colony of birds or seals,S,,active
ESTR,rubber plantation,an estate which specializes in growing and tapping rubber trees,S,,active
RUIN,ruin(s),a destroyed or decayed structure which is no longer functional,S,,active
BDGQ,ruined bridge,a destroyed or decayed bridge which is no longer functional,S,,active
DAMQ,ruined dam,a destroyed or decayed dam which is no longer functional,S,,active
SBKH,sabkha(s),a salt flat or salt encrusted plain subject to periodic inundation from flooding or high tides,H,,active
SDL,saddle,"a broad, open pass crossing a ridge or between hills or mountains",T,,active
SALT,salt area,a shallow basin or flat where salt accumulates after periodic inundation,L,,active
MFGN,salt evaporation ponds,diked salt ponds used in the production of solar evaporated salt,H,,active
LKN,salt lake,an inland body of salt water with no outlet,H,,active
LKSN,salt lakes,inland bodies of salt water with no outlet,H,,active
MRSHN,salt marsh,"a flat area, subject to periodic salt water inundation, dominated by grassy salt-tolerant plants",H,,active
MNN,salt mine(s),a mine from which salt is extracted,S,,active
PNDN,salt pond,"a small standing body of salt water often in a marsh or swamp, usually along a seacoast",H,,active
PNDSN,salt ponds,"small standing bodies of salt water often in a marsh or swamp, usually along a seacoast",H,,active
SNTR,sanatorium,a facility where victims of physical or mental disorders are treated,S,,active
SAND,sand area,a tract of land covered with sand,T,,active
ERG,sandy desert,an extensive tract of shifting sand and sand dunes,T,,active
STNS,satellite station,a facility for tracking and communicating with orbiting satellites,S,,active
MLSW,sawmill,a mill where logs or lumber are sawn to specified shapes and sizes,S,,active
SCH,school,building(s) where instruction in one or more branches of knowledge takes place,S,,active
ADMS,school district,school district,A,,active
STNB,scientific research base,a scientific facility used as a base from which research is carried out or monitored,S,,active
SCRB,scrubland,"an area of low trees, bushes, and shrubs stunted by some environmental limitation",V,,active
SEA,sea,a large body of salt water more or less confined by continuous land or chains of islands forming a subdivision of an ocean,H,,active
SCNU,seachannel,"a continuously sloping, elongated depression commonly found in fans or plains and customarily bordered by levees on one or two sides",U,,active
SCSU,seachannels,"continuously sloping, elongated depressions commonly found in fans or plains and customarily bordered by levees on one or two sides",U,,active
SMU,seamount,"an elevation rising generally more than 1,000 meters and of limited extent across the summit",U,,active
SMSU,seamounts,"elevations rising generally more than 1,000 meters and of limited extent across the summit",U,,active
AIRS,seaplane landing area,a place on a waterbody where floatplanes land and take off,H,,active
PPLA,seat of a first-order administrative division,seat of a first-order administrative division (PPLC takes precedence over PPLA),P,,active
PPLA4,seat of a fourth-order administrative division,seat of a fourth-order administrative division,P,,active
PPLA2,seat of a second-order administrative division,seat of a second-order administrative division,P,,active
PPLA3,seat of a third-order administrative division,seat of a third-order administrative division,P,,active
ADM2,second-order administrative division,a subdivision of a first-order administrative division,A,,active
BNKX,section of bank,section of bank,H,,active
CNLX,section of canal,section of canal,H,,active
ESTX,section of estate,section of estate,S,,active
HBRX,section of harbor,section of harbor,H,,active
PCLIX,section of independent political entity,section of independent political entity,A,,active
STMIX,section of intermittent stream,section of intermittent stream,H,,active
ISLX,section of island,section of island,T,,active
LGNX,section of lagoon,section of lagoon,H,,active
LKX,section of lake,section of lake,H,,active
PENX,section of peninsula,section of peninsula,T,,active
PLNX,section of plain,section of plain,T,,active
PLATX,section of plateau,section of plateau,T,,active
PPLX,section of populated place,section of populated place,P,,active
RFX,section of reef,section of reef,H,,active
STMX,section of stream,section of stream,H,,active
VALX,section of valley,section of valley,T,,active
WADX,section of wadi,section of wadi,H,,active
FLLSX,section of waterfall(s),section of waterfall(s),H,,active
PCLS,semi-independent political entity,semi-independent political entity,A,,active
SWT,sewage treatment plant,facility for the processing of sewage and/or wastewater,S,,active
SHPF,sheepfold,a fence or wall enclosure for sheep and other small herd animals,S,,active
SHOL,shoal(s),a surface-navigation hazard composed of unconsolidated material,H,,active
SHOPC,shopping center or mall,an urban shopping area featuring a variety of shops surrounding a usually open-air concourse reserved for pedestrian traffic; or a large suburban building or group of buildings containing various shops with associated passageways,S,,active
SHOR,shore,"a narrow zone bordering a waterbody which covers and uncovers at high and low water, respectively",T,,active
SHRN,shrine,a structure or place memorializing a person or religious concept,S,,active
SILL,sill,the low part of a gap or saddle separating basins,H,,active
SINK,sinkhole,a small crater-shape depression in a karst area,T,,active
ESTSL,sisal plantation,an estate that specializes in growing sisal,S,,active
SLID,slide,"a mound of earth material, at the base of a slope and the associated scoured area",T,,active
SLP,slope(s),a surface with a relatively uniform slope angle,T,,active
SLCE,sluice,"a conduit or passage for carrying off surplus water from a waterbody, usually regulated by means of a sluice gate",S,,active
SNOW,snowfield,an area of permanent snow and ice forming the accumulation area of a glacier,L,,active
SD,sound,a long arm of the sea forming a channel between the mainland and an island or islands; or connecting two larger bodies of water,H,,active
SPA,spa,a resort area usually developed around a medicinal spring,S,,active
CTRS,space center,"a facility for launching, tracking, or controlling satellites and space vehicles",S,,active
SPLY,spillway,"a passage or outlet through which surplus water flows over, around or through a dam",S,,active
SPIT,spit,"a narrow, straight or curved continuation of a beach into a waterbody",T,,active
SPNG,spring(s),a place where ground water flows naturally out of the ground,H,,active
SPUR,spur(s),"a subordinate ridge projecting outward from a hill, mountain or other elevation",T,,active
SQR,square,"a broad, open, public area near the center of a town or city",S,,active
STBL,stable,"a building for the shelter and feeding of farm animals, especially horses",S,,active
STDM,stadium,a structure with an enclosure for athletic games with tiers of seats for spectators,S,,active
STPS,steps,stones or slabs placed for ease in ascending or descending a steep slope,S,,active
STKR,stock route,a route taken by livestock herds,R,,active
REG,stony desert,a desert plain characterized by a surface veneer of gravel and stones,T,,active
RET,store,a building where goods and/or services are offered for sale,S,,active
SHSE,storehouse,"a building for storing goods, especially provisions",S,,active
STRT,strait,"a relatively narrow waterway, usually narrower and less extensive than a sound, connecting two larger bodies of water",H,,active
STM,stream,a body of running water moving to a lower level in a channel on land,H,,active
BNKR,stream bank,a sloping margin of a stream channel which normally confines the stream to its channel on land,H,,active
STMB,stream bend,a conspicuously curved or bent segment of a stream,H,,active
