code,name,description,category,url,status
0,not targeted,"The score ""not targeted"" means that the activity was examined but found not to target the policy objective.",,,active
1,significant objective,"Significant (secondary) policy objectives are those which, although important, were not the prime motivation for undertaking the activity.",,,active
2,principal objective,"Principal (primary) policy objectives are those which can be identified as being fundamental in the design and impact of the activity and which are an explicit objective of the activity. They may be selected by answering the question ""Would the activity have been undertaken without this objective?""",,,active
3,principal objective AND in support of an action programme,For desertification-related aid only,,,active
4,Explicit primary objective,,,,active
